<!ELEMENT cataleg (single*, album*)>

<!ELEMENT single (titol, descripcio, pais, idioma, genere, grup, membres, durada)>
<!ATTLIST single codi ID #REQUIRED>

<!ELEMENT album (titol, descripcio, pais, idioma, genere, grup, membres, numero_cançons, titols_cançons)>
<!ATTLIST album codi ID #REQUIRED>

<!ELEMENT titols_cançons (canço+)>

<!ELEMENT canço (titol_canço, durada_canço)>
<!ATTLIST canço numero CDATA #REQUIRED>

<!ELEMENT titol (#PCDATA)>

<!ELEMENT descripcio (#PCDATA)>

<!ELEMENT pais (#PCDATA)>

<!ELEMENT idioma (#PCDATA)>

<!ELEMENT grup (#PCDATA)>

<!ELEMENT membres (membre+)>

<!ELEMENT membre (nom)>
<!ATTLIST membre sexe (home | dona) #REQUIRED>

<!ELEMENT nom (#PCDATA)>

<!ELEMENT durada (#PCDATA)>

<!ELEMENT numero_cançons (#PCDATA)>

<!ELEMENT titol_canço (#PCDATA)>

<!ELEMENT durada_canço (#PCDATA)>

<!ELEMENT genere (#PCDATA)>