<?xml version="1.0" encoding="UTF-8"?>
<!DOCTYPE cataleg SYSTEM "cataleg.dtd">
<cataleg>
    <single codi="S001">
        <titol>Canco A</titol>
        <descripcio>Una canco de pop</descripcio>
        <pais>Espanya</pais>
        <idioma>Espanyol</idioma>
        <genere>Pop</genere>
        <grup>Grup X</grup>
        <membres>
            <membre sexe="home">
                <nom>Nom 1</nom>
            </membre>
            <membre sexe="dona">
                <nom>nom 2</nom>
            </membre>
        </membres>
        <durada>3</durada>
    </single>


    <album codi="A001">
        <titol>Album B</titol>
        <descripcio>Un album de rock</descripcio>
        <pais>Espanya</pais>
        <idioma>Angles</idioma>
        <genere>Rock</genere>
        <grup>Grup Y</grup>
        <membres>
            <membre sexe="home">
                <nom>nom  4</nom>
            </membre>
            <membre sexe="dona">
                <nom>nom 4</nom>
            </membre>
        </membres>
        <numero_cançons>3</numero_cançons>
        <titols_cançons>
            <canço numero="1">
                <titol_canço>Cançó 1</titol_canço>
                <durada_canço>4</durada_canço>
            </canço>
            <canço numero="2">
                <titol_canço>Cançó 2</titol_canço>
                <durada_canço>5</durada_canço>
            </canço>
            <canço numero="3">
                <titol_canço>Cançó 3</titol_canço>
                <durada_canço>6</durada_canço>
            </canço>
        </titols_cançons>
    </album>
</cataleg>
